{
  "schemaVersion": "molit.edc-local-interoperability-run/1",
  "recordingMode": "recorder",
  "runId": "b8f4430a-d313-4efc-8751-c0432e881b26",
  "status": "pass",
  "startedAt": "2026-07-14T09:25:45.856Z",
  "completedAt": "2026-07-14T09:27:05.071Z",
  "command": ".\\tools\\edc\\run-smoke.ps1 -RecordEvidence evidence/edc/runs/20260714T182543+0900-implementation-8a87894.json",
  "sourceBinding": {
    "algorithm": "sha-256",
    "digest": "524fae74e92c718f513c6afa7ccd9e65f5f1fa23d649ea3b36177a1785bcd882",
    "fileCount": 48,
    "scope": "deploy/edc, tools/edc, tests/edc, .gitattributes, package.json, package-lock.json, contracts/edc-local-interoperability-run.v1.schema.json; excluding build and .gradle directories"
  },
  "sourceStable": true,
  "git": {
    "captured": true,
    "headAtStart": "8a878949727d37e5d375915b3b6a043509c8c4c4",
    "headAtEnd": "8a878949727d37e5d375915b3b6a043509c8c4c4",
    "scopedPaths": [
      "deploy/edc",
      "tools/edc",
      "tests/edc",
      ".gitattributes",
      "package.json",
      "package-lock.json",
      "contracts/edc-local-interoperability-run.v1.schema.json"
    ],
    "statusAtStart": [],
    "statusAtEnd": [],
    "cleanAtStart": true,
    "cleanAtEnd": true
  },
  "docker": {
    "captured": true,
    "server": {
      "version": "25.0.3",
      "operatingSystem": "linux",
      "architecture": "amd64"
    },
    "composeVersion": "2.24.6-desktop.1",
    "images": [
      {
        "service": "consumer-control-plane",
        "imageId": "sha256:503d016ed06b9e2a095f49ae83e997e7aec9cce62d933d3e9621224863f776b3"
      },
      {
        "service": "consumer-data-plane",
        "imageId": "sha256:2acad1fd6bd54aa75378af2f5017def65b8e9e1689edc52de6cd08dfc4f30e3c"
      },
      {
        "service": "provider-backend",
        "imageId": "sha256:d0701bd41f8279135aa6c81e23fbcdae7bcc3df591c47741405412a8dcdb2eab"
      },
      {
        "service": "provider-control-plane",
        "imageId": "sha256:e84a77c8b6528fb78e7b52d005fc1117b37254df23074d2fbad2c5d93ed59845"
      },
      {
        "service": "provider-data-plane",
        "imageId": "sha256:176c507cfe4fa4c37b21f0e41a07ffb475eb2cc8ac5e38814a83de1d89623ef0"
      }
    ]
  },
  "cleanStart": {
    "attempted": true,
    "status": "pass"
  },
  "cleanup": {
    "attempted": true,
    "status": "pass"
  },
  "execution": {
    "exitCode": 0,
    "stdout": {
      "captureMode": "runner-captured",
      "encoding": "utf-8",
      "sha256": "38e6f57a557b22c628ae09a324dbf6310450f49405fe3f9f5437026e329ae4c6",
      "byteLength": 437,
      "text": "{\"ok\":true,\"managementApi\":\"v4\",\"dsp\":\"dataspace-protocol-http:2025-1\",\"assetId\":\"molit-edc-smoke-asset-70fd70a8-695e-4127-87db-e26a506c9164\",\"agreementId\":\"45e51bfa-22fe-47f2-876d-bb7fd9807b18\",\"transferId\":\"d7ddd22d-7460-4efc-8073-105838f99c62\",\"startState\":\"STARTED\",\"finalState\":\"TERMINATED\",\"revokedStatus\":403,\"bytes\":96,\"contentType\":\"application/json\",\"sha256\":\"2f013648aa3071d46c9e29b2e938c5fb36336cc53f27d1f5e507da3683da41a7\"}\n"
    },
    "result": {
      "ok": true,
      "managementApi": "v4",
      "dsp": "dataspace-protocol-http:2025-1",
      "assetId": "molit-edc-smoke-asset-70fd70a8-695e-4127-87db-e26a506c9164",
      "agreementId": "45e51bfa-22fe-47f2-876d-bb7fd9807b18",
      "transferId": "d7ddd22d-7460-4efc-8073-105838f99c62",
      "startState": "STARTED",
      "finalState": "TERMINATED",
      "revokedStatus": 403,
      "bytes": 96,
      "contentType": "application/json",
      "sha256": "2f013648aa3071d46c9e29b2e938c5fb36336cc53f27d1f5e507da3683da41a7"
    },
    "error": null
  },
  "limitations": [
    "same Eclipse EDC Connector implementation on both participants",
    "DSP official TCK and cross-implementation interoperability not executed",
    "production DPS worker, identity, trust anchors and public delivery service not verified",
    "Maven dependency verification, SBOM, image signature and license inventory not complete"
  ]
}
