{
  "schemaVersion": "molit.edc-local-interoperability-run/1",
  "recordingMode": "recorder",
  "runId": "2cb9b59d-ba9e-4219-87cf-0bf5c8e53c24",
  "status": "pass",
  "startedAt": "2026-07-14T13:38:57.928Z",
  "completedAt": "2026-07-14T13:40:19.887Z",
  "command": ".\\tools\\edc\\run-smoke.ps1 -RecordEvidence evidence/edc/runs/20260714T2240+0900-p0-schema-admission.json",
  "sourceBinding": {
    "algorithm": "sha-256",
    "digest": "2cf510c3fd326a2fb5320f596c5c176face0e1da66b6a12cdd4ff3fde39a916b",
    "fileCount": 52,
    "scope": "deploy/edc, tools/edc, tests/edc, .gitattributes, package.json, package-lock.json, contracts/edc-local-interoperability-run.v1.schema.json; excluding build and .gradle directories"
  },
  "sourceStable": true,
  "git": {
    "captured": true,
    "headAtStart": "b20c5f591a8fb5d0c7e50bc6309251af46b94323",
    "headAtEnd": "b20c5f591a8fb5d0c7e50bc6309251af46b94323",
    "scopedPaths": [
      "deploy/edc",
      "tools/edc",
      "tests/edc",
      ".gitattributes",
      "package.json",
      "package-lock.json",
      "contracts/edc-local-interoperability-run.v1.schema.json"
    ],
    "statusAtStart": [
      " M molit-dataspace/deploy/edc/Dockerfile",
      " M molit-dataspace/deploy/edc/compose.smoke.yaml",
      " M molit-dataspace/deploy/edc/runtime/control-plane/build.gradle.kts",
      " M molit-dataspace/deploy/edc/runtime/settings.gradle.kts",
      " M molit-dataspace/deploy/edc/upstream-lock.json",
      " M molit-dataspace/package.json",
      " M molit-dataspace/tests/edc/topology-static.test.mjs",
      " M molit-dataspace/tools/edc/build-runtime.mjs",
      " M molit-dataspace/tools/edc/verify-topology.mjs",
      "?? molit-dataspace/deploy/edc/database-schema/migration-manifest.v1.json",
      "?? molit-dataspace/deploy/edc/database-schema/run-schema-migration.sh",
      "?? molit-dataspace/deploy/edc/runtime-artifacts.v1.json",
      "?? molit-dataspace/deploy/edc/runtime/smoke-control-plane/build.gradle.kts"
    ],
    "statusAtEnd": [
      " M molit-dataspace/deploy/edc/Dockerfile",
      " M molit-dataspace/deploy/edc/compose.smoke.yaml",
      " M molit-dataspace/deploy/edc/runtime/control-plane/build.gradle.kts",
      " M molit-dataspace/deploy/edc/runtime/settings.gradle.kts",
      " M molit-dataspace/deploy/edc/upstream-lock.json",
      " M molit-dataspace/package.json",
      " M molit-dataspace/tests/edc/topology-static.test.mjs",
      " M molit-dataspace/tools/edc/build-runtime.mjs",
      " M molit-dataspace/tools/edc/verify-topology.mjs",
      "?? molit-dataspace/deploy/edc/database-schema/migration-manifest.v1.json",
      "?? molit-dataspace/deploy/edc/database-schema/run-schema-migration.sh",
      "?? molit-dataspace/deploy/edc/runtime-artifacts.v1.json",
      "?? molit-dataspace/deploy/edc/runtime/smoke-control-plane/build.gradle.kts"
    ],
    "cleanAtStart": false,
    "cleanAtEnd": false
  },
  "docker": {
    "captured": true,
    "server": {
      "version": "25.0.3",
      "operatingSystem": "linux",
      "architecture": "amd64"
    },
    "composeVersion": "2.24.6-desktop.1",
    "images": [
      {
        "service": "consumer-control-plane",
        "imageId": "sha256:5e996106ccfac8050129a68f4de4e3b31a8ec4b3dfab65cb555bd366a95e95f5"
      },
      {
        "service": "consumer-data-plane",
        "imageId": "sha256:6a8d1c65cd887457e439576b43f82017cd5b1a280852d3a9bb8264f71a9bfb22"
      },
      {
        "service": "provider-backend",
        "imageId": "sha256:d0701bd41f8279135aa6c81e23fbcdae7bcc3df591c47741405412a8dcdb2eab"
      },
      {
        "service": "provider-control-plane",
        "imageId": "sha256:f2845e678a1c6c0b52db827f8870c9f06fd6126d66e041089dcf569aa22565c0"
      },
      {
        "service": "provider-data-plane",
        "imageId": "sha256:db52e77f7ce8b973171e040336e4e044e68c506fd449b44d14ba523078601263"
      }
    ]
  },
  "cleanStart": {
    "attempted": true,
    "status": "pass"
  },
  "cleanup": {
    "attempted": true,
    "status": "pass"
  },
  "execution": {
    "exitCode": 0,
    "stdout": {
      "captureMode": "runner-captured",
      "encoding": "utf-8",
      "sha256": "2b841da69c70842b87cd8bcf6dffc3a10a8143d18fc6222b674554249c153152",
      "byteLength": 437,
      "text": "{\"ok\":true,\"managementApi\":\"v4\",\"dsp\":\"dataspace-protocol-http:2025-1\",\"assetId\":\"molit-edc-smoke-asset-316a9ac0-8e8f-4186-88e1-4020dce5c3dd\",\"agreementId\":\"fad5203c-b69c-4248-8990-bbce6a1244a0\",\"transferId\":\"5e878ccb-1dc9-4d8c-8666-91777975665a\",\"startState\":\"STARTED\",\"finalState\":\"TERMINATED\",\"revokedStatus\":403,\"bytes\":96,\"contentType\":\"application/json\",\"sha256\":\"2f013648aa3071d46c9e29b2e938c5fb36336cc53f27d1f5e507da3683da41a7\"}\n"
    },
    "result": {
      "ok": true,
      "managementApi": "v4",
      "dsp": "dataspace-protocol-http:2025-1",
      "assetId": "molit-edc-smoke-asset-316a9ac0-8e8f-4186-88e1-4020dce5c3dd",
      "agreementId": "fad5203c-b69c-4248-8990-bbce6a1244a0",
      "transferId": "5e878ccb-1dc9-4d8c-8666-91777975665a",
      "startState": "STARTED",
      "finalState": "TERMINATED",
      "revokedStatus": 403,
      "bytes": 96,
      "contentType": "application/json",
      "sha256": "2f013648aa3071d46c9e29b2e938c5fb36336cc53f27d1f5e507da3683da41a7"
    },
    "error": null
  },
  "limitations": [
    "same Eclipse EDC Connector implementation on both participants",
    "DSP official TCK and cross-implementation interoperability not executed",
    "production DPS worker, identity, trust anchors and public delivery service not verified",
    "Maven dependency verification, SBOM, image signature and license inventory not complete"
  ]
}
